{
  "plan_dir": "plugin-plans/extract-system-blueprint",
  "evaluator": {
    "name": "assign-plugin-plan-evaluator",
    "version": "0.2.0",
    "context": "fork"
  },
  "verdict": "PASS",
  "conditions": {
    "C1": {
      "id": "no_contradiction",
      "status": "PASS",
      "summary": "決定論ゲート(check-build-handoff/check-plugin-surface-audit)がexit0、かつR6監査(a)(f)(h)で検出した契約間の数値・文言の矛盾は0件。index.mdの可読ダイジェスト2箇所で検出した条件文/レンズ列挙の省略(medium finding 2件)は修正確認済み(resolved)。",
      "evidence": [
        "check-build-handoff.py plugin-plans/extract-system-blueprint/handoff-run-plugin-dev-plan.json => exit=0, stdout='OK: build handoff が 14 routes と envelope 契約を満たす'",
        "check-plugin-surface-audit.py --plugins-dir plugins --strict-manifest --expect-plan-ready plugin-dev-planner => exit=0（17plugin監査、envelope-draft/plugin.json含め矛盾0）",
        "component-inventory.json#C08.matcher = 'Bash|WebFetch|mcp__browser-runtime.*|mcp__notion.*' と envelope-draft/plugin.json#hooks.PreToolUse[0].matcher = 'Bash|WebFetch|mcp__browser-runtime.*|mcp__notion.*' が文字列完全一致（直接Read確認）",
        "component-inventory.json#C09/#C03/#C12のload_policy.mode_note/budget_mode_noteが3箇所ともverbatimで同一文言（'runtime_max_*とtotal_origin_bytes_ceiling(=runtime_max_bytes+runtime_max_screenshot_bytesの導出値)はcrawl_mode=single時の既定。full_site時はcrawl_profile.full_siteのper-run予算が置換しtotal_origin_bytes_ceilingは適用しない。瞬間負荷レバー...は両モード不変'）で矛盾なし",
        "handoff-run-plugin-dev-plan.json内 GAP-BROWSER-RUNTIME(id) のtextが『未構成時の帰結はinventory plugin_level_surfaces.mcp_app_connectorの条件文を正本とする(...gap記録つきPASS可)』とinventory本体の条件文を正しく参照し矛盾なし",
        "修正後再検証: index.md:91のMCP/app connector行が二分岐条件文へ更新され、index.md:74の完全形と非対称でなくなったことを直接Readで確認（旧C3 finding=resolved）"
      ]
    },
    "C2": {
      "id": "no_missing",
      "status": "PASS",
      "summary": "detect-unassigned/check-surface-inventory/check-requirements-coverage/check-plugin-goal-spec全exit0。orphan 0件、plugin_level_surfaces 6面の採否が明示済み、14 component全てにtask-graph produces edgeが張られている。",
      "evidence": [
        "detect-unassigned.py --inventory .../component-inventory.json --specs-dir . => exit=0, stdout='OK: 13 フェーズ完全・section 床充足・orphan 0 件・全 component が build_target を保持'（修正後再実行でも同一結果）",
        "check-surface-inventory.py .../component-inventory.json => exit=0, stdout='OK: 5 component_kind 検討証跡 + plugin-level surface 採否が明示済み'",
        "check-requirements-coverage.py . => exit=0, stdout='OK: goal-spec checklist の全要件 id が index の完了チェックリスト/受入確認へトレース済み'（修正後再実行でも同一結果）",
        "check-plugin-goal-spec.py .../goal-spec.json => exit=0, stdout='OK: plugin goal-spec schema + plugin anchors validated'",
        "index.md:146『各componentが>=1 phaseのentities_coveredに出現する(orphan 0件)』チェックリスト項目を独立確認（同旨をdetect-unassignedが機械保証）",
        "task-graph.json実測: nodes=103, edges=307(depends_on=203/parent_of=90/produces=14)。produces edgeがC01-C14の14 component全てに1件以上存在することをpython3集計で確認"
      ]
    },
    "C3": {
      "id": "consistent",
      "status": "PASS",
      "summary": "check-spec-matrix-coverage(self-test/PLAN)双方exit0。R6監査(a)(c)(d)(e)は完全一致・drift0を確認。index.mdの可読ダイジェスト部で検出した2件の軽微な非対称（C04レンズ行のOWASP欠落、MCP/app connector行の条件文一分岐省略）はteam-leadにより修正され、実文面Readで反映を確認した（resolved、medium→info)。",
      "evidence": [
        "check-spec-matrix-coverage.py --self-test => exit=0, stdout='OK: 46行 table と reflection.md が一致 (id 集合/分類/焼き先層 drift なし)'（修正後再実行でも同一結果）",
        "check-spec-matrix-coverage.py plugin-plans/extract-system-blueprint => exit=0, stdout='matrix 分類: OP=10 / conditional=19 / N-A=17 (計 46)' + 'OK: 適用される全マトリクス行の焼き先が反映済み'（修正後再実行でも同一結果）",
        "grep -rniE '8名|12名|名のLens|名の著名|8 lenses|12 lenses' plugin-plans/extract-system-blueprint/ => 現行ファイルに一致0件。inventory expert_lenses合計=C03(2)+C04(3)+C05(2)+C13(4)+C06(2)=13名で一致",
        "grep -rln 'fetch-render' plugin-plans/extract-system-blueprint/ => 0件。fetch-snapshot.pyがgoal-spec/handoff/inventory/index/task-graph/phase-08/briefsで一貫参照",
        "component-inventory.json#C11.description/quality_gatesにPNG生成/縮小記述なし。C03がredacted screenshot/annotated.png(≤4MiB)を撮影時点で確定させ、asset_key=C03出力byteである旨がnotion_config.databasesと一致。C11はmd/json/SVG/manifestのstdlib_onlyテキスト操作限定",
        "修正後再検証(index.md:103): '| C04 | backend-inference-analyzer (sub-agent) | バックエンド機構+named stack同定+security_design(受動観測のみ)+delivery_topologyの根拠+確度つき推測(レンズ Kleppmann/Vogels/OWASP) | C03 |' — OWASPを含む3レンズを列挙し、index.md:69『C04=Kleppmann/Vogels/OWASP』と整合、他行との表記非対称は解消",
        "修正後再検証(index.md:91): '| MCP/app connector | omitted | 新規connectorは作らず、設置先のbrowser-runtime(MCP server名固定・aliasで充足可)を外部依存として再利用 (未構成時: JS要観測が重要fact該当ならC02 FAIL・静的完結が実測で示せる場合はgap記録つきPASS可。正本=inventory `mcp_app_connector` 条件文) |' — 二分岐条件文を反映し、index.md:74の完全形と整合"
      ]
    },
    "C4": {
      "id": "dependency_integrity",
      "status": "PASS",
      "summary": "verify-index-topsort/detect-unassigned/check-build-handoff/validate-task-graph/check-runtime-portability全exit0。build順top-sortとdepends_onが全component間で矛盾なく、resume両辺契約(C01/C12)も3点で完全一致。",
      "evidence": [
        "verify-index-topsort.py . => exit=0, stdout='OK: index が §9 section 床を満たし P01..P13 を昇順全列挙し component 依存 DAG が非循環'（修正後再実行でも同一結果）",
        "check-build-handoff.py .../handoff-run-plugin-dev-plan.json => exit=0",
        "validate-task-graph.py . => exit=0（標準出力なし=違反0件、スクリプト仕様上サイレント成功が正常挙動）",
        "check-runtime-portability.py . => exit=0, stdout='OK: 共有 script は plugin-root へ hoist 済・全 build_target が plugin 内自己完結'",
        "index.md:112『build 順 (依存 top-sort): C10/C11/C12→C09,C08→C03→C04,C05,C13→C06→C01→C02→C07,C14』が全componentのdepends_on列と矛盾なし",
        "component-inventory.json#C01.responsibilities[R1-fetch].summary『再開runは前runのsite coverage manifestを読み、pendingと未分類discoveredをC12 --coverage-manifest-in経由で分類対象へ再投入する(resume状態のwriter=C11/reader=C12を両辺契約化)』と #C12.load_policy.crawl_profile.full_site.resume_state『site coverage manifest(次runは--coverage-manifest-inで受領しpending∪未分類discoveredを分類対象へ再投入する)』および #C01.inputs argv『--coverage-manifest-in FILE』の3点が完全一致"
      ]
    }
  },
  "gate_results": [
    {
      "id": "G1",
      "name": "verify-index-topsort",
      "command": ["python3", "plugins/plugin-dev-planner/skills/run-plugin-dev-plan/scripts/verify-index-topsort.py", "plugin-plans/extract-system-blueprint"],
      "exit_code": 0,
      "conditions": ["C4"],
      "stdout": "OK: index が §9 section 床を満たし P01..P13 を昇順全列挙し component 依存 DAG が非循環"
    },
    {
      "id": "G2",
      "name": "check-plugin-goal-spec",
      "command": ["python3", "plugins/plugin-dev-planner/skills/run-plugin-dev-plan/scripts/check-plugin-goal-spec.py", "plugin-plans/extract-system-blueprint/goal-spec.json"],
      "exit_code": 0,
      "conditions": ["C2"],
      "stdout": "OK: plugin goal-spec schema + plugin anchors validated"
    },
    {
      "id": "G3",
      "name": "detect-unassigned",
      "command": ["python3", "plugins/plugin-dev-planner/skills/run-plugin-dev-plan/scripts/detect-unassigned.py", "--inventory", "plugin-plans/extract-system-blueprint/component-inventory.json", "--specs-dir", "plugin-plans/extract-system-blueprint"],
      "exit_code": 0,
      "conditions": ["C2", "C4"],
      "stdout": "OK: 13 フェーズ完全・section 床充足・orphan 0 件・全 component が build_target を保持"
    },
    {
      "id": "G4",
      "name": "check-spec-frontmatter",
      "command": ["python3", "plugins/plugin-dev-planner/skills/run-plugin-dev-plan/scripts/check-spec-frontmatter.py", "--specs-dir", "plugin-plans/extract-system-blueprint"],
      "exit_code": 0,
      "conditions": ["C2", "C3"],
      "stdout": "OK: 13 phase frontmatter + inventory component 契約を充足"
    },
    {
      "id": "G5",
      "name": "check-spec-gates",
      "command": ["python3", "plugins/plugin-dev-planner/skills/run-plugin-dev-plan/scripts/check-spec-gates.py", "--specs-dir", "plugin-plans/extract-system-blueprint"],
      "exit_code": 0,
      "conditions": ["C2", "C3"],
      "stdout": "OK: inventory component gates/harness + index.plugin_meta 規律を機械強制で満たす"
    },
    {
      "id": "G6",
      "name": "check-spec-matrix-coverage-self-test",
      "command": ["python3", "plugins/plugin-dev-planner/skills/run-plugin-dev-plan/scripts/check-spec-matrix-coverage.py", "--self-test"],
      "exit_code": 0,
      "conditions": ["C3"],
      "stdout": "OK: 46行 table と reflection.md が一致 (id 集合/分類/焼き先層 drift なし)"
    },
    {
      "id": "G7",
      "name": "check-spec-matrix-coverage-plan",
      "command": ["python3", "plugins/plugin-dev-planner/skills/run-plugin-dev-plan/scripts/check-spec-matrix-coverage.py", "plugin-plans/extract-system-blueprint"],
      "exit_code": 0,
      "conditions": ["C3"],
      "stdout": "matrix 分類: OP=10 / conditional=19 / N-A=17 (計 46)\nOK: 適用される全マトリクス行の焼き先が反映済み"
    },
    {
      "id": "G8",
      "name": "check-surface-inventory",
      "command": ["python3", "plugins/plugin-dev-planner/skills/run-plugin-dev-plan/scripts/check-surface-inventory.py", "plugin-plans/extract-system-blueprint/component-inventory.json"],
      "exit_code": 0,
      "conditions": ["C2"],
      "stdout": "OK: 5 component_kind 検討証跡 + plugin-level surface 採否が明示済み"
    },
    {
      "id": "G9",
      "name": "check-build-handoff",
      "command": ["python3", "plugins/plugin-dev-planner/skills/run-plugin-dev-plan/scripts/check-build-handoff.py", "plugin-plans/extract-system-blueprint/handoff-run-plugin-dev-plan.json"],
      "exit_code": 0,
      "conditions": ["C1", "C4"],
      "stdout": "OK: build handoff が 14 routes と envelope 契約を満たす"
    },
    {
      "id": "G10",
      "name": "check-requirements-coverage",
      "command": ["python3", "plugins/plugin-dev-planner/skills/run-plugin-dev-plan/scripts/check-requirements-coverage.py", "plugin-plans/extract-system-blueprint"],
      "exit_code": 0,
      "conditions": ["C2"],
      "stdout": "OK: goal-spec checklist の全要件 id が index の完了チェックリスト/受入確認へトレース済み"
    },
    {
      "id": "G11",
      "name": "check-runtime-portability",